business,"Safety alert as GM recalls cars

The world's biggest carmaker General Motors (GM) is recalling nearly 200,000 vehicles in the US on safety grounds, according to federal regulators."
business,"Further rise in UK jobless total

The UK's jobless total rose for the second month in a row in December, official figures show."
business,"China bans new tobacco factories

The world's biggest tobacco consumer, China, has said it will not allow any new tobacco factories to be built."
business,"BT offers equal access to rivals

BT has moved to pre-empt a possible break-up of its business by offering to cut wholesale broadband prices and open its network to rivals."
business,"Japan's ageing workforce: built to last

In his twenties he battled tuberculosis for eight years, then went on to run his own clothing business before marrying in his late thirties. And the 101-year-old Torao Toshitsune has eaten raw fish pretty much every day throughout his life."
business,"US prepares for hybrid onslaught

Sales of hybrid cars in the US are set to double in 2005, research suggests."
business,"Circuit City gets takeover offer

Circuit City Stores, the second-largest electronics retailer in the US, has received a $3.25bn (£1.7bn) takeover offer."
business,"Takeover offer for Sunderland FC

Bob Murray, chairman of Sunderland FC, has launched a £1.5m ($2.8m) bid for the club after buying broadcaster BSkyB's stake in the business."
business,"Malaysia lifts Islamic bank limit

Malaysia's central bank is to relax restrictions on foreign ownership to encourage Islamic banking."
business,"Beijingers fume over parking fees

Choking traffic jams in Beijing are prompting officials to look at reorganising car parking charges."
business,"Newest EU members underpin growth

The European Union's newest members will bolster Europe's economic growth in 2005, according to a new report."
business,"India-Pakistan peace boosts trade

Calmer relations between India and Pakistan are paying economic dividends, with new figures showing bilateral trade up threefold in the summer."
business,"Steady job growth continues in US

The US created fewer jobs than expected in December, but analysts said that the dip in hiring was not enough to derail the world's biggest economy."
business,"Cairn shares slump on oil setback

Shares in Cairn Energy, a UK oil firm, have closed down 18% after a disappointing drilling update and a warning over possible tax demands."
business,"Diageo to buy US wine firm

Diageo, the world's biggest spirits company, has agreed to buy Californian wine company Chalone for $260m (£134m) in an all-cash deal."
business,"Gold falls on IMF sale concerns

The price of gold has fallen after the International Monetary Fund (IMF) said it will look at ways of using its gold reserves to provide debt relief."
business,"Madagascar completes currency switch

Madagascar has completed the replacement of its Malagasy franc with a new currency, the ariary."
business,"Profits jump at China's top bank

Industrial and Commercial Bank (ICBC), China's biggest lender, has seen an 18% jump in profits during 2004."
business,"Call to save manufacturing jobs

The Trades Union Congress (TUC) is calling on the government to stem job losses in manufacturing firms by reviewing the help it gives companies."
business,"Feta cheese battle reaches court

A row over whether only Greece should be allowed to label its cheese feta has reached the European Court of Justice."
business,"Oil rebounds from weather effect

Oil prices recovered in Asian trade on Tuesday, after falling in New York on milder winter weather across the US."
business,"Oil companies get Russian setback

International oil and mining companies have reacted cautiously to Russia's decision to bar foreign firms from natural resource tenders in 2005."
business,"Swiss cement firm in buying spree

Swiss cement firm Holcim has bid $800m (£429m) to buy two Indian cement firms and a holding company in the country."
business,"Brazil jobless rate hits new low

Brazil's unemployment rate fell to its lowest level in three years in December, according to the government."
business,"Could Yukos be a blessing in disguise?

Other things being equal, the notion of entrepreneurs languishing in jail while their companies are sold off for a song ought to be bad for business."
business,"Sluggish economy hits German jobs

The number of people out of work in Europe's largest economy has risen for the tenth straight month as growth remains stubbornly slow."
business,"Asian banks halt dollar's slide

The dollar regained some lost ground against most major currencies on Wednesday after South Korea and Japan denied they were planning a sell-off."
business,"Turkey knocks six zeros off lira

Turkey is to relaunch its currency on Saturday, knocking six zeros off the lira in the hope of boosting trade and powering its growing economy."
business,"Disney settles disclosure charges

Walt Disney has settled charges from US federal regulators that it failed to disclose how family members of directors were employed by the company."
business,"Yukos bankruptcy 'not US matter'

Russian authorities do not have to abide by any US court decisions taken with regard to troubled oil giant Yukos, a Houston court has been told."
business,"Delta cuts fares in survival plan

Delta Air Lines is cutting domestic fares by as much as 50% as part of a plan to ensure its financial survival."
business,"US manufacturing expands

US industrial production increased in December, according to the latest survey from the Institute for Supply Management (ISM)."
business,"Dollar hits new low versus euro

The US dollar has continued its record-breaking slide and has tumbled to a new low against the euro."
business,"Wal-Mart to pay $14m in gun suit

The world's largest retailer, Wal-Mart, has agreed to pay a total of $14.5m (£7.74m) to settle a lawsuit over gun sales violations in California."
business,"McDonald's to sponsor MTV show

McDonald's, the world's largest restaurant chain, is to sponsor a programme on music channel MTV as part of its latest youth market promotion."
business,"Russia gets investment blessing

Soaring oil sales and a budget surplus mean Russian debt is no longer a risky investment, one of the world's leading credit rating agencies says."
business,"Dollar gains on Greenspan speech

The dollar has hit its highest level against the euro in almost three months after the Federal Reserve head said the US trade deficit is set to stabilise."
business,"Yukos owner sues Russia for $28bn

The majority owner of embattled Russian oil firm Yukos has sued the Russian government for $28.3bn (£15.2bn)."
business,"Parmalat bank barred from suing

Bank of America has been banned from suing Parmalat, the food group which went bust in 2003 after an accounting scandal."
business,"Amex shares up on spin-off news

Shares in American Express surged more than 8% on Tuesday after it said it was to spin off its less profitable financial advisory subsidiary."
business,"Ukraine trims privatisation check

Ukraine is to review ""dozens"" of state asset sales as the country's new administration tackles corruption."
business,"Brazil buy boosts Belgium's Inbev

Belgian brewing giant Inbev has seen its profits soar thanks to its acquisition of Brazil's biggest beer firm Ambev last year."
business,"Golden rule 'intact' says ex-aide

Chancellor Gordon Brown will meet his golden economic rule ""with a margin to spare"", according to his former chief economic adviser."
business,"US bank 'loses' customer details

The Bank of America has revealed it has lost computer tapes containing account details of more than one million customers who are US federal employees."
business,"French wine gets 70m euro top-up

The French government is to hand its struggling wine industry 70m euros ($91m) in aid to help it battle falling sales and damaging overproduction."
business,"Deutsche Boerse boosts dividend

Deutsche Boerse, the German stock exchange that is trying to buy its London rival, has said it will boost its 2004 dividend payment by 27%."
business,"Honda wins China copyright ruling

Japan's Honda has won a copyright case in Beijing, further evidence that China is taking a tougher line on protecting intellectual property rights."
business,"Dollar drops on reserves concerns

The US dollar has dropped against major currencies on concerns that central banks may cut the amount of dollars they hold in their foreign reserves."
business,"UK economy ends year with spurt

The UK economy grew by an estimated 3.1% in 2004 after accelerating in the last quarter of the year, says the Office for National Statistics (ONS)."
business,"Ask Jeeves tips online ad revival

Ask Jeeves has become the third leading online search firm this week to thank a revival in internet advertising for improving fortunes."
business,"Businesses fail to plan for HIV

Companies fail to draw up plans to cope with HIV/Aids until it affects 20% of people in a country, new research says."
business,"Dollar slides ahead of New Year

The US dollar has hit a new record low against the euro and analysts predict that more declines are likely in 2005."
business,"Profits slide at India's Dr Reddy

Profits at Indian drugmaker Dr Reddy's fell 93% as research costs rose and sales flagged."
business,"Parmalat sues 45 banks over crash

Parmalat has sued 45 banks as it tries to reclaim money paid to banks before the scandal-hit Italian dairy company went bust last year."
business,"US interest rate rise expected

US interest rates are expected to rise for the fifth time since June following the US Federal Reserve's latest rate-setting meeting later on Tuesday."
business,"Bank payout to Pinochet victims

A US bank has said it will donate more than $8m to victims of former Chilean military ruler Augusto Pinochet's regime under a Madrid court settlement."
business,"High fuel costs hit US airlines

Two of the largest airlines in the US - American and Southwest - have blamed record fuel prices for their disappointing quarterly results."
business,"SA unveils 'more for all' budget

The South African government has put tax cuts and increased social spending at the centre of its latest budget."
business,"Bank voted 8-1 for no rate change

The decision to keep interest rates on hold at 4.75% earlier this month was passed 8-1 by the Bank of England's rate-setting body, minutes have shown."
business,"Wembley firm won't make a profit

Shares in Multiplex Group, which is building the new Wembley stadium, fell as much as 19% after it said it would not make any money on the project."
business,"J&J agrees $25bn Guidant deal

Pharmaceutical giant Johnson & Johnson has agreed to buy medical technology firm Guidant for $25.4bn (£13bn)."
business,"Marsh executive in guilty plea

An executive at US insurance firm Marsh & McLennan has pleaded guilty to criminal charges in connection with an ongoing fraud and bid-rigging probe."
business,"Irish markets reach all-time high

Irish shares have risen to a record high, with investors persuaded to buy into the market by low inflation and strong growth forecasts."
business,"Retail sales show festive fervour

UK retail sales were better than expected in November as Christmas shoppers began their seasonal flock to the High Street, figures show."
business,"Argentina, Venezuela in oil deal

Argentina and Venezuela have extended a food-for-oil deal, which helped the former to overcome a severe energy crisis last year."
business,"Winemaker rejects Foster's offer

Australian winemaker Southcorp has rejected a takeover offer worth 3.1bn Australian dollars ($2.3bn; £1.8bn) from brewing giant Foster's Group."
business,"Qantas considers offshore option

Australian airline Qantas could transfer as many as 7,000 jobs out of its home country as it seeks to save costs, according to newspaper reports."
business,"Brazil approves bankruptcy reform

A major reform of Brazil's bankruptcy laws has been approved by the country's Congress, in a move which it is hoped will cut the cost of borrowing."
business,"Aviation firms eye booming India

India's defence minister has opened the country's Aero India 2005 air show with an invitation for global aerospace firms to outsource jobs to the nation."
business,"Japanese banking battle at an end

Japan's Sumitomo Mitsui Financial has withdrawn its takeover offer for rival bank UFJ Holdings, enabling the latter to merge with Mitsubishi Tokyo."
business,"Boeing secures giant Japan order

Boeing is to supply Japan Airlines with up to 50 of its forthcoming 7E7 planes in a deal that could be worth as much as $6bn (£3.1bn) for the US giant."
business,"India and Iran in gas export deal

India has signed a $40bn (£21bn) deal to import millions of tonnes of liquefied natural gas from Iran."
business,"US in EU tariff chaos trade row

The US has asked the World Trade Organisation to investigate European Union customs tariffs, which it says are inconsistent and hamper trade."
business,"Pension hitch for long-living men

Male life expectancy is much higher than originally estimated, leading pension researchers have said."
business,"Christmas sales worst since 1981

UK retail sales fell in December, failing to meet expectations and making it by some counts the worst Christmas since 1981."
business,"Putin backs state grab for Yukos

Russia's president has defended the purchase of Yukos' key production unit by state-owned oil firm Rosneft, saying it followed free market principles."
business,"FBI agent colludes with analyst

A former FBI agent and an internet stock picker have been found guilty of using confidential US government information to manipulate stock prices."
business,"Business confidence dips in Japan

Business confidence among Japanese manufacturers has weakened for the first time since March 2003, the quarterly Tankan survey has found."
business,"Mixed Christmas for US retailers

US retailers posted mixed results for December - with luxury retailers faring well while many others were forced to slash prices to lift sales."
business,"BA to suspend two Saudi services

British Airways is to halt its flights from London Heathrow to Jeddah and Riyadh in Saudi Arabia from 27 March."
business,"Air passengers win new EU rights

Air passengers who are unable to board their flights because of overbooking, cancellations or flight delays can now demand greater compensation."
business,"Card fraudsters 'targeting web'

New safeguards on credit and debit card payments in shops has led fraudsters to focus on internet and phone payments, an anti-fraud agency has said."
business,"Yukos drops banks from court bid

Russian oil company Yukos has dropped the threat of legal action against five banks it had accused of involvement in the sale of its key Yugansk unit."
business,"Euronext 'poised to make LSE bid'

Pan-European group Euronext is poised to launch a bid for the London Stock Exchange, UK media reports say."
business,"Lacroix label bought by US firm

Luxury goods group LVMH has sold its loss-making Christian Lacroix clothing label to a US investment group."
business,"Building giant in asbestos payout

Australian building products group James Hardie has agreed to pay $1.1bn (£568m) to victims of asbestos-related diseases."
business,"Banker loses sexism claim

A former executive at the London offices of Merrill Lynch has lost her £7.5m ($14.6m) sex discrimination case against the US investment bank."
business,"Dutch bank to lay off 2,850 staff

ABN Amro, the Netherlands' largest bank, is to cut 2,850 jobs as a result of falling profits."
business,"Bank set to leave rates on hold

UK interest rates are set to remain on hold at 4.75% following the latest meeting of the Bank of England."
business,"Consumer spending lifts US growth

US economic growth accelerated in the third quarter, helped by strong consumer spending, official figures have shown."
business,"US gives foreign firms extra time

Foreign firms have been given an extra year to meet tough new corporate governance regulations imposed by the US stock market watchdog."
business,"Monsanto fined $1.5m for bribery

The US agrochemical giant Monsanto has agreed to pay a $1.5m (£799,000) fine for bribing an Indonesian official."
business,"Nortel in $300m profit revision

Telecoms equipment maker Nortel Networks has sharply revised downwards its profits for the 2003 fiscal year."
business,"ECB holds rates amid growth fears

The European Central Bank has left its key interest rate unchanged at 2% for the 19th month in succession."
business,"Jarvis sells Tube stake to Spain

Shares in engineering group Jarvis have soared more than 16% on news that it is offloading its stake in London underground consortium Tube Lines."
business,"China now top trader with Japan

China overtook the US to become Japan's biggest trading partner in 2004, according to numbers released by Japan's Finance Ministry on Wednesday."
business,"Trial begins of Spain's top banker

The trial of Emilio Botin, the chairman of Spain's most powerful bank, Santander Central Hispano, has started in Madrid."
business,"US regulator to rule on pain drug

US food and drug regulators will decide on Friday whether to recommend the sale of painkillers that have been linked to a high risk of heart attack and stroke."
business,"Japan narrowly escapes recession

Japan's economy teetered on the brink of a technical recession in the three months to September, figures show."
business,"Five million Germans out of work

Germany's unemployment figure rose above the psychologically important level of five million last month."
business,"World leaders gather to face uncertainty

More than 2,000 business and political leaders from around the globe are arriving in the Swiss mountain resort Davos for the annual World Economic Forum (WEF). For five days, they will discuss issues ranging from China's economic power to Iraq's future after this Sunday's elections. UK Prime Minister Tony Blair and South African President Thabo Mbeki are among the more than 20 government leaders and heads of state leaders attending the meeting. Unlike previous years, protests against the WEF are expected to be muted. Anti-globalisation campaigners have called off a demonstration planned for the weekend."
business,"Iranian MPs threaten mobile deal

Turkey's biggest private mobile firm could bail out of a $3bn ($1.6bn) deal to build a network in Iran after MPs there slashed its stake in the project."
business,"EU ministers to mull jet fuel tax

European Union finance ministers are meeting on Thursday in Brussels, where they are to discuss a controversial jet fuel tax."
business,"Krispy Kreme shares hit

Shares in Krispy Kreme Doughnuts have taken a dunking on Wall Street after the firm revealed it would have to restate its 2004 financial reports."
business,"Industrial revival hope for Japan

Japanese industry is growing faster than expected, boosting hopes that the country's retreat back into recession is over."
business,"Water firm Suez in Argentina row

A conflict between the Argentine State and water firm Aguas Argentinas, controlled by France's Suez, is casting doubt on the firm's future."
business,"Senior Fannie Mae bosses resign

The two most senior executives at US mortgage giant Fannie Mae have resigned after accounting irregularities were uncovered at the company."
business,"US retail sales surge in December

US retail sales ended the year on a high note with solid gains in December, boosted by strong car sales."
business,"Nigeria to boost cocoa production

The government of Nigeria is hoping to triple cocoa production over the next three years with the launch of an ambitious development programme."
business,"FAO warns on impact of subsidies

Billions of farmers' livelihoods are at risk from falling commodity prices and protectionism, the UN's Food & Agriculture Organisation has warned."
business,"Ryanair in $4bn Boeing plane deal

Budget airline Ryanair has placed an order for 70 Boeing 737-800 planes, in a deal valued at $4bn (£2.1bn) which should lead to 2,500 new Ryanair jobs."
business,"Car giant hit by Mercedes slump

A slump in profitability at luxury car maker Mercedes has prompted a big drop in profits at parent DaimlerChrysler."
business,"BBC poll indicates economic gloom

Citizens in a majority of nations surveyed in a BBC World Service poll believe the world economy is worsening."
business,"China had role in Yukos split-up

China lent Russia $6bn (£3.2bn) to help the Russian government renationalise the key Yuganskneftegas unit of oil group Yukos, it has been revealed."
business,"Macy's owner buys rival for $11bn

US retail giant Federated Department Stores is to buy rival May Department Stores for $11bn (£5.7bn)."
business,"Israeli economy picking up pace

Israel's economy is forecast to grow by 4.2% in 2004 as it continues to emerge from a three-year recession."
business,"News Corp eyes video games market

News Corp, the media company controlled by Australian billionaire Rupert Murdoch, is eyeing a move into the video games market."
business,"Hariri killing hits Beirut shares

Shares in Solidere, the Lebanese company founded by assassinated former prime minister Rafik Hariri, fell 15% in renewed trading in Beirut."
business,"Indy buys into India paper

Irish publishing group Independent News & Media is buying up a 26% stake in Indian newspaper company Jagran in a deal worth 25m euros ($34.1m)."
business,"Umbro profits lifted by Euro 2004

UK sportswear firm Umbro has posted a 222% rise in annual profit after sales of replica England football kits were boosted by the Euro 2004 tournament."
business,"Asian quake hits European shares

Shares in Europe's leading reinsurers and travel firms have fallen as the scale of the damage wrought by tsunamis across south Asia has become apparent."
business,"BP surges ahead on high oil price

Oil giant BP has announced a 26% rise in annual profits to $16.2bn (£8.7bn) on the back of record oil prices."
business,"Arsenal 'may seek full share listing'

Arsenal vice-chairman David Dein has said the club may consider seeking a full listing for its shares on the London Stock Exchange."
business,"Green reports shun supply chain

Nearly 20% more UK top 250 firms produced non-financial reports on social and environment issues than last year."
business,"Cactus diet deal for Phytopharm

A slimming aid made from a southern African cactus is set to be developed by UK firm Phytopharm and Unilever."
business,"Novartis hits acquisition trail

Swiss drugmaker Novartis has announced 5.65bn euros ($7.4bn; £3.9bn) of purchases to make its Sandoz unit the world's biggest generic drug producer."
business,"Ex-Boeing director gets jail term

An ex-chief financial officer at Boeing has received a four-month jail sentence and a fine of $250,000 (£131,961) for illegally hiring a top Air Force aide."
business,"Saudi NCCI's shares soar

Shares in Saudi Arabia's National Company for Cooperative Insurance (NCCI) soared on their first day of trading in Riyadh."
business,"Nissan names successor to Ghosn

Nissan has named a lifetime employee to run its operations after Carlos Ghosn, its highly successful boss, takes charge at Renault."
business,"Lloyd's of London head chides FSA

The head of Lloyd's of London, the insurance market, has criticised Britain's financial watchdog, the Financial Services Authority (FSA)."
business,"EMI shares hit by profit warning

Shares in music giant EMI have sunk by more than 16% after the firm issued a profit warning following disappointing sales and delays to two album releases."
business,"Worldcom director ends evidence

The former chief financial officer at US telecoms firm WorldCom has finished giving evidence at the trial of his ex-boss Bernie Ebbers."
business,"Barclays profits hit record level

Barclays, the UK's third-biggest bank, has seen annual pre-tax profits climb to record levels boosted by a sharp rise in business at its investment arm."
business,"India and Russia in energy talks

India and Russia are to work together in a series of energy deals, part of a pact which could see India invest up to $20bn in oil and gas projects."
business,"WorldCom trial starts in New York

The trial of Bernie Ebbers, former chief executive of bankrupt US phone company WorldCom, has started in New York with the selection of the jury."
business,"Barclays shares up on merger talk

Shares in UK banking group Barclays have risen on Monday following a weekend press report that it had held merger talks with US bank Wells Fargo."
business,"Court rejects $280bn tobacco case

A US government claim accusing the country's biggest tobacco companies of covering up the effects of smoking has been thrown out by an appeal court."
business,"'Strong dollar' call halts slide

The US dollar's slide against the euro and yen has halted after US Treasury Secretary John Snow said a strong dollar was ""in America's interest""."
business,"US trade deficit widens sharply

The gap between US exports and imports has widened to more than $60bn (£31.7bn), an all-time record."
business,"Tsunami cost hits Jakarta shares

The stock market in Jakarta has seen its biggest slide in a month, after the country doubled the likely cost of rebuilding from the Asian tsunami."
business,"Venezuela and China sign oil deal

Venezuelan president Hugo Chavez has offered China wide-ranging access to the country's oil reserves."
business,"GM issues 2005 profits warning

General Motors has warned that it expects earnings this year be lower than in 2004."
business,"Germany calls for EU reform

German Chancellor Gerhard Schroeder has called for radical reform of the EU's stability pact to grant countries more flexibility over their budget deficits."
