tech,"Computer grid to help the world

Your computer can now help solve the world's most difficult health and social problems."
tech,"Gadget growth fuels eco concerns

Technology firms and gadget lovers are being urged to think more about the environment when buying and disposing of the latest hi-tech products."
tech,"Sony wares win innovation award

Sony has taken the prize for top innovator at the annual awards of PC Pro Magazine."
tech,"New Year's texting breaks record

A mobile phone was as essential to the recent New Year's festivities as a party mood and Auld Lang Syne, if the number of text messages sent is anything to go by."
tech,"Players sought for $1m prize

UK gamers are getting a chance to take part in a $1m tournament thanks to one of the country's top teams."
tech,"Sporting rivals go to extra time

The current slew of sports games offers unparalleled opportunities for fans who like to emulate on-field action without ever moving from the couch."
tech,"Half-Life 2 sweeps Bafta awards

PC first person shooter Half-Life 2 has won six Bafta Awards, including best game and best online game."
tech,"Latest Opera browser gets vocal

Net browser Opera 8.0, due for official release at the end of next month, will be ""the most accessible browser on the market"", according to its authors."
tech,"Dublin hi-tech labs to shut down

Dublin's hi-tech research laboratory, Media Labs Europe, is to shut down."
tech,"Fast moving phone viruses appear

Security firms are warning about several mobile phone viruses that can spread much faster than similar bugs."
tech,"Progress on new internet domains

By early 2005 the net could have two new domain names."
tech,"Warnings about junk mail deluge

The amount of spam circulating online could be about to undergo a massive increase, say experts."
tech,"Concern over RFID tags

Consumers are very concerned about the use of radio frequency ID (RFID) tags in shops, a survey says."
tech,"Virus poses as Christmas e-mail

Security firms are warning about a Windows virus disguising itself as an electronic Christmas card."
tech,"Text message record smashed

UK mobile owners continue to break records with their text messaging, with latest figures showing that 26 billion texts were sent in total in 2004."
tech,"Telewest to challenge Sky Plus

Cable firm Telewest is to offer a personal video recorder (PVR) in a set -top box to challenge Sky Plus."
tech,"Long life promised for laptop PCs

Scientists are working on ways to ensure laptops can stay powered for an entire working day."
tech,"Freeze on anti-spam campaign

A campaign by Lycos Europe to target spam-related websites appears to have been put on hold."
tech,"Gadget show heralds MP3 Christmas

Partners of those who love their hi-tech gear may want to get their presents in early as experts predict a gadget shortage this Christmas."
tech,"Cebit opens to mobile music tune

Cebit, the world's largest hi-tech fair, has opened its doors in Hanover for a look at the latest technologies for homes and businesses."
tech,"Microsoft debuts security tools

Microsoft is releasing tools that clean up PCs harbouring viruses and spyware."
tech,"How to make a greener computer

The hi-tech industry is starting to get more environmentally aware. Bill Thompson thinks it's about time."
tech,"Consumer concern over RFID tags

Consumers are very concerned about the use of radio frequency ID (RFID) tags in shops, a survey says."
tech,"Toxic web links help virus spread

Virus writers have begun using the power of the web to spread their malicious wares."
tech,"Text message record smashed again

UK mobile owners continue to break records with their text messaging, with latest figures showing that 26 billion texts were sent in total in 2004."
tech,"New consoles promise big problems

Making games for future consoles will require more graphic artists and more money, an industry conference has been told."
tech,"Spam e-mails tempt net shoppers

Computer users across the world continue to ignore security warnings about spam e-mails and are being lured into buying goods, a report suggests."
tech,"GTA sequel is criminally good

The Grand Theft Auto series of games have set themselves the very highest of standards in recent years, but the newest addition is more than able to live up to an increasingly grand tradition."
tech,"Kenyan school turns to handhelds

At the Mbita Point primary school in western Kenya students click away at a handheld computer with a stylus."
tech,"Media gadgets get moving

Pocket-sized devices that let people carry around video and images are set to have a big year in 2005, according to industry experts."
tech,"Blinx sequel purrs nicely

The original Blinx was intended to convert many platform game lovers to Microsoft's then new Xbox console."
tech,"Sun offers processing by the hour

Sun Microsystems has launched a pay-as-you-go service which will allow customers requiring huge computing power to rent it by the hour."
tech,"Text messages aid disaster recovery

Text messaging technology was a valuable communication tool in the aftermath of the tsunami disaster in Asia."
tech,"Santy worm makes unwelcome visit

Thousands of website bulletin boards have been defaced by a virus that used Google to spread across the net."
tech,"IBM puts cash behind Linux push

IBM is spending $100m (£52m) over the next three years beefing up its commitment to Linux software."
tech,"Mobile gaming takes off in India

Gaming on the move is one of the fastest-growing activities among the tech-savvy in India, says a report."
tech,"Cebit fever takes over Hanover

Thousands of products and tens of thousands of visitors make Cebit the place to be for technology lovers."
tech,"Court mulls file-sharing future

Judges at the US Supreme Court have been hearing evidence for and against file-sharing networks."
tech,"Chip maker backs net phone calls

Rich Templeton, the head of giant chip maker Texas Instruments, has given his backing to the growing sector of Voice over Internet Telephony (Voip)"
tech,"Anti-spam laws bite spammer hard

The net's self-declared spam king is seeking bankruptcy protection."
tech,"Millions to miss out on the net

By 2025, 40% of the UK's population will still be without internet access at home, says a study."
tech,"Movie body targets children's PCs

The body that represents the US movie industry has released its latest tool in its campaign to clamp down on movie file-sharing, aimed at parents."
tech,"China net cafe culture crackdown

Chinese authorities closed 12,575 net cafes in the closing months of 2004, the country's government said."
tech,"Gadget show heralds MP3 season

Partners of those who love their hi-tech gear may want to get their presents in early as experts predict a gadget shortage this Christmas."
tech,"Cable offers video-on-demand

Cable firms NTL and Telewest have both launched video-on-demand services as the battle between satellite and cable TV heats up."
tech,"Cyber criminals step up the pace

So-called phishing attacks that try to trick people into handing over confidential details have boomed in 2004, say security experts."
tech,"US duo in first spam conviction

A brother and sister in the US have been convicted of sending hundreds of thousands of unsolicited e-mail messages to AOL subscribers."
tech,"Web logs aid disaster recovery

Some of the most vivid descriptions of the devastation in southern Asia are on the internet - in the form of web logs or blogs."
tech,"Nintendo DS aims to touch gamers

The mobile gaming industry is set to explode in 2005 with a number of high-profile devices offering a range of gaming and other features such as movie and music playback. Market leader Nintendo, however, is releasing a handheld console that it says will revolutionise the way games are played."
tech,"Web radio takes Spanish rap global

Spin the radio dial in the US and you are likely to find plenty of Spanish-language music. But what you will not find is much Spanish-language hip-hop."
tech,"'Ultimate game' award for Doom 3

Sci-fi shooter Doom 3 has blasted away the competition at a major games ceremony, the Golden Joystick awards."
tech,"'No re-draft' for EU patent law

A proposed European law on software patents will not be re-drafted by the European Commission (EC) despite requests by MEPs."
tech,"US blogger fired by her airline

A US airline attendant suspended over ""inappropriate images"" on her blog - web diary - says she has been fired."
tech,"UK net users leading TV downloads

British TV viewers lead the trend of illegally downloading US shows from the net, according to research."
tech,"T-Mobile bets on 'pocket office'

T-Mobile has launched its latest ""pocket office"" third-generation (3G) device which also has built-in wi-fi - high-speed wireless net access."
tech,"Mobile games come of age

The BBC News website takes a look at how games on mobile phones are maturing. A brief round-up follows but you can skip straight to the reviews by clicking on the links below."
tech,"Web radio takes Spanish rap global

Spin the radio dial in the US and you are likely to find plenty of Spanish-language music. But what you will not find is much Spanish-language hip-hop."
tech,"A question of trust and technology

A major government department is without e-mail for a week, and technology analyst Bill Thompson wants to know what happened."
tech,"Junk e-mails on relentless rise

Spam traffic is up by 40%, putting the total amount of e-mail that is junk up to an astonishing 90%."
tech,"'Blog' picked as word of the year

The term ""blog"" has been chosen as the top word of 2004 by a US dictionary publisher."
tech,"Ask Jeeves joins web log market

Ask Jeeves has bought the Bloglines website to improve the way it handles content from web journals or blogs."
tech,"Apple Mac mini gets warm welcome

The Mac mini has been welcomed by Apple fans, industry experts and PC users."
tech,"Losing yourself in online gaming

Online role playing games are time-consuming, but enthralling flights from reality. But are some people taking their fantasy lives too seriously?"
tech,"Solutions to net security fears

Fake bank e-mails, or phishing, and stories about ID theft are damaging the potential of using the net for online commerce, say e-business experts."
tech,"Gamers could drive high-definition

TV, films, and games have been gearing up for some time now for the next revolution to transform the quality of what is on our screens."
tech,"New delay hits EU software laws

A fresh delay has hit controversial new European Union rules which govern computer-based inventions."
tech,"Mobiles get set for visual radio

The growth in the mobile phone market in the past decade has been nothing less than astonishing, but the ability to communicate on the go is not the only reason we are hooked. Games, cameras and music players have all been added to our handsets in the last few years, but 2005 could see another big innovation that won't just see a change in our mobile phone habits - it might alter the way we listen to the radio. Finnish handset giant Nokia has been working on a technology called Visual Radio, which takes an existing FM signal from a radio station and enables that station to add enhancements such as information and pictures. It is not the first time that such an idea has been suggested - the early days of DAB Digital Radio had similar intentions that never really saw the light of day."
tech,"Slim PlayStation triples sales

Sony PlayStation 2's slimmer shape has proved popular with UK gamers, with 50,000 sold in its first week on sale."
tech,"Mobile networks seek turbo boost

Third-generation mobile (3G) networks need to get faster if they are to deliver fast internet surfing on the move and exciting new services."
tech,"Mobile networks seek turbo boost

Third-generation mobile (3G) networks need to get faster if they are to deliver fast internet surfing on the move and exciting new services."
tech,"Internet boom for gift shopping

Cyberspace is becoming a very popular destination for Christmas shoppers."
tech,"Apple iPod family expands market

Apple has expanded its iPod family with the release of its next generation of the digital music players."
tech,"More power to the people says HP

The digital revolution is focused on letting people tell and share their own stories, according to Carly Fiorina, chief of technology giant Hewlett Packard."
tech,"Xbox power cable 'fire fear'

Microsoft has said it will replace more than 14 million power cables for its Xbox consoles due to safety concerns."
tech,"Google to scan famous libraries

The libraries of five of the world's most important academic institutions are to be digitised by Google."
tech,"Hi-tech posters guide commuters

Interactive posters are helping Londoners get around the city during the festive season."
tech,"More women turn to net security

Older people and women are increasingly taking charge of protecting home computers against malicious net attacks, according to a two-year study."
tech,"Can Yahoo dominate next decade?

Yahoo has reached the grand old age of 10 and, in internet years, that is a long time."
tech,"Mac Mini heralds mini revolution

The Mac Mini was launched amid much fanfare by Apple and great excitement by Apple watchers last month. But does the latest Macintosh justify the hype? Let us get a few things dealt with at the outset - yes, the Mac Mini is really, really small, and yes, it is another piece of inspired Apple design. There is more to be said on the computer's size and design but it is worth highlighting that the Mac Mini is a just a computer. Inside that small box there is a G4 processor, a CD/DVD player, a hard drive, some other technical bits and bobs and an operating system. A DVD burner, wireless and bluetooth technologies can be bought at extra cost. And if you do not have a monitor, keyboard or mouse then you will need to purchase those also."
tech,"Apple unveils low-cost 'Mac mini'

Apple has unveiled a new, low-cost Macintosh computer for the masses, billed as the Mac mini."
tech,"When invention turns to innovation

It is unlikely that future technological inventions are going to have the same kind of transformative impact that they did in the past."
tech,"'Brainwave' cap controls computer

A team of US researchers has shown that controlling devices with the brain is a step closer."
tech,"Microsoft seeking spyware trojan

Microsoft is investigating a trojan program that attempts to switch off the firm's anti-spyware software."
tech,"US cyber security chief resigns

The man making sure US computer networks are safe and secure has resigned after only a year in his post."
tech,"Sony PSP tipped as a 'must-have'

Sony's Playstation Portable is the top UK gadget for 2005, according to a round-up of ultimate gizmos compiled by Stuff Magazine."
tech,"Online commons to spark debate

Online communities set up by the UK government could encourage public debate and build trust, says the Institute of Public Policy Research (IPPR)."
tech,"Wi-fi web reaches farmers in Peru

A network of community computer centres, linked by wireless technology, is providing a helping hand for poor farmers in Peru."
tech,"Souped-up wi-fi is on the horizon

Super high-speed wireless data networks could soon be in use in the UK."
tech,"Norway upholds 'Napster' ruling

A Norwegian student who ran a website which linked to downloadable MP3 files has been ordered to pay compensation by the country's Supreme Court."
tech,"US peer-to-peer pirates convicted

The first convictions for piracy over peer-to-peer networks have been handed down in the US."
tech,"Video phones act as dating tools

Technologies, from e-mail, to net chatrooms, instant messaging and mobiles, have proved to be a big pull with those looking for love."
tech,"File-swappers ready new network

Legal attacks on websites that help people swap pirated films have forced the development of a system that could be harder to shut down."
tech,"DVD copy protection strengthened

DVDs will be harder to copy thanks to new anti-piracy measures devised by copy protection firm Macrovision."
tech,"Dozens held over ID fraud site

Twenty-eight people, including a Briton, have been arrested after a global operation against a website allegedly involved in identity fraud."
tech,"Tough rules for ringtone sellers

Firms that flout rules on how ringtones and other mobile extras are sold could be cut off from all UK phone networks."
tech,"Millions buy MP3 players in US

One in 10 adult Americans - equivalent to 22 million people - owns an MP3 player, according to a survey."
tech,"Joke e-mail virus tricks users

A virus that disguises itself as a joke is spreading rapidly across the net."
tech,"Rich pickings for hi-tech thieves

Viruses, trojans and other malicious programs sent on to the net to catch you out are undergoing a subtle change."
tech,"Games win for Blu-ray DVD format

The next-generation DVD format Blu-ray is winning more supporters than its rival, according to its backers."
tech,"Apple makes blogs reveal sources

Apple has won its legal fight to make three bloggers reveal who told them about unreleased products."
tech,"Europe backs digital TV lifestyle

How people receive their digital entertainment in the future could change, following the launch of an ambitious European project."
tech,"Mobile audio enters new dimension

As mobile phones move closer to being a ubiquitous, all-in-one media player, audio is becoming ever more important. But how good can that sound be from such a small device?"
tech,"Apple iPod family expands market

Apple has expanded its iPod family with the release of its next generation of the digital music players."
tech,"Broadband steams ahead in the US

More and more Americans are joining the internet's fast lane, according to official figures."
tech,"Halo 2 heralds traffic explosion

The growing popularity of online gaming could spell problems for net service firms, warns network monitoring company Sandvine."
tech,"US hacker breaks into T-Mobile

A man is facing charges of hacking into computers at the US arm of mobile phone firm T-Mobile."
tech,"BT program to beat dialler scams

BT is introducing two initiatives to help beat rogue dialler scams, which can cost dial-up net users thousands."
tech,"Speak easy plan for media players

Music and film fans will be able to control their digital media players just by speaking to them, under plans in development by two US firms."
tech,"How to make a gigapixel picture

The largest digital panoramic photo in the world has been created by researchers in the Netherlands."
tech,"When technology gets personal

In 2020, whipping out your mobile phone to make a call will be quaintly pass&#233;. By then phones will be printed directly on to wrists, or other parts of the body, says Ian Pearson, BT's resident futurologist."
tech,"TV future in the hands of viewers

With home theatre systems, plasma high-definition TVs, and digital video recorders moving into the living room, the way people watch TV will be radically different in five years' time."
tech,"BBC web search aids odd queries

The BBC's online search engine was used a record amount in 2004, helping with enquires both simple and strange."
tech,"How to smash a home computer

An executive who froze his broken hard disk thinking it would be fixed has topped a list of the weirdest computer mishaps."
tech,"New browser wins over net surfers

The proportion of surfers using Microsoft's Internet Explorer (IE) has dropped to below 90%, say web analysts."
tech,"'Ultimate game' award for Doom 3

Sci-fi shooter Doom 3 has blasted away the competition at a major games ceremony, the Golden Joystick awards."
tech,"Mobiles double up as bus tickets

Mobiles could soon double up as travel cards, with Nokia planning to try out a wireless ticket system on German buses."
tech,"Google's toolbar sparks concern

Search engine firm Google has released a trial tool which is concerning some net users because it directs people to pre-selected commercial websites."
tech,"Web helps collect aid donations

The web is helping aid agencies gather resources to help cope with the aftermath of the tsunami disaster."
tech,"Domain system opens door to scams

A system to make it easier to create website addresses using alphabets like Cyrillic could open a back door for scammers, a trade body has warned."
tech,"Warnings on woeful wi-fi security

Companies are getting worse at keeping their wireless data networks secure."
tech,"Tech helps disabled speed demons

An organisation has been launched to encourage disabled people to get involved in all aspects of motorsport, which is now increasingly possible thanks to technological innovations."
tech,"PlayStation 3 processor unveiled

The Cell processor, which will drive Sony's PlayStation 3, will run 10-times faster than current PC chips, its designers have said."
tech,"Europe backs digital TV lifestyle

How people receive their digital entertainment in the future could change, following the launch of an ambitious European project."
tech,"Net regulation 'still possible'

The blurring of boundaries between TV and the internet raises questions of regulation, watchdog Ofcom has said."
tech,"Nuclear body seeks new tech

The computer systems used to monitor the world's nuclear power installations are so outdated that they are hampering the work of inspectors."
tech,"'Brainwave' cap controls computer

A team of US researchers has shown that controlling devices with the brain is a step closer."
tech,"Technology gets the creative bug

The hi-tech and the arts worlds have for some time danced around each other and offered creative and technical help when required."
tech,"Microsoft releases patches

Microsoft has warned PC users to update their systems with the latest security fixes for flaws in Windows programs."
tech,"Broadband fuels online expression

Fast web access is encouraging more people to express themselves online, research suggests."
tech,"Apple unveils low-cost 'Mac mini'

Apple has unveiled a new, low-cost Macintosh computer for the masses, billed as the Mac mini."
tech,"Mobile gig aims to rock 3G

Forget about going to a crowded bar to enjoy a gig by the latest darlings of the music press."
tech,"Podcasts mark rise of DIY radio

An Apple iPod or other digital music players can hold anything up to 10,000 songs, which is a lot of space to fill."
tech,"Bad e-mail habits sustains spam

The 'bad behaviour' of e-mail users is helping to sustain the spam industry, a new study has found."
tech,"Finding new homes for old phones

Re-using old mobile phones is not just good for the environment, it has social benefits too."
tech,"Iran jails blogger for 14 years

An Iranian weblogger has been jailed for 14 years on charges of spying and aiding foreign counter-revolutionaries."
tech,"Sony PSP console hits US in March

US gamers will be able to buy Sony's PlayStation Portable from 24 March, but there is no news of a Europe debut."
tech,"Casual gaming to 'take off'

Games aimed at ""casual players"" are set to be even bigger in 2005, according to industry experts."
tech,"PC ownership to 'double by 2010'

The number of personal computers worldwide is expected to double by 2010 to 1.3 billion machines, according to a report by analysts Forrester Research."
tech,"EA to take on film and TV giants

Video game giant Electronic Arts (EA) says it wants to become the biggest entertainment firm in the world."
tech,"Microsoft releases bumper patches

Microsoft has warned PC users to update their systems with the latest security fixes for flaws in Windows programs."
tech,"BT offers free net phone calls

BT is offering customers free internet telephone calls if they sign up to broadband in December."
tech,"Games enter the classroom

Video games could soon be transplanted from their natural habitat to the more academic atmosphere of the classroom."
tech,"Hollywood campaign hits websites

Movie studio efforts to stop pirated films being shared on peer-to-peer networks have claimed a high-profile victim."
tech,"Global blogger action day called

The global web blog community is being called into action to lend support to two imprisoned Iranian bloggers."
tech,"Sony PSP console hits US in March

US gamers will be able to buy Sony's PlayStation Portable from 24 March, but there is no news of a Europe debut."
tech,"First look at PlayStation 3 chip

Some details of the chip inside Sony's PlayStation 3 have been revealed."
tech,"US duo in first spam conviction

A brother and sister in the US have been convicted of sending hundreds of thousands of unsolicited e-mail messages to AOL subscribers."
tech,"T-Mobile bets on 'pocket office'

T-Mobile has launched its latest ""pocket office"" third-generation (3G) device which also has built-in wi-fi - high-speed wireless net access."
tech,"Online games play with politics

After bubbling under for some time, online games broke through onto the political arena in 2004."
tech,"Bush website blocked outside US

Surfers outside the US have been unable to visit the official re-election site of President George W Bush."
tech,"Millions to miss out on the net

By 2025, 40% of the UK's population will still be without internet access at home, says a study."
tech,"IBM puts cash behind Linux push

IBM is spending $100m (£52m) over the next three years beefing up its commitment to Linux software."
tech,"Peer-to-peer nets 'here to stay'

Peer-to-peer (P2P) networks are here to stay, and are on the verge of being exploited by commercial media firms, says a panel of industry experts."
tech,"Peer-to-peer nets 'here to stay'

Peer-to-peer (P2P) networks are here to stay, and are on the verge of being exploited by commercial media firms, says a panel of industry experts."
