politics,"Talks held on Gibraltar's future

Two days of talks on the future of Gibraltar begin at Jack Straw's country residence later on Wednesday."
politics,"Jack Cunningham to stand down

Veteran Labour MP and former Cabinet minister Jack Cunningham has said he will stand down at the next election."
politics,"Burglar defence guidelines issued

Householders who injure or even kill intruders are unlikely to be prosecuted - providing they were acting ""honestly and instinctively"", new guidelines say."
politics,"Blair moves to woo Jewish voters

Tony Blair has pledged to ""never, ever, ever"" attack Tory leader Michael Howard over his Jewish beliefs."
politics,"Campaign 'cold calls' questioned

Labour and the Conservatives are still telephoning the millions of people who have signed up to make sure they do not get marketing ""cold calls""."
politics,"Labour's core support takes stock

Tony Blair has told Labour supporters he's ""back"" and still hungry for the job of prime minister - but does that sum up the mood at the party's spring conference in Gateshead?"
politics,"Mandelson warns BBC on Campbell

The BBC should steer away from ""demonising"" ex-Downing Street media chief Alastair Campbell, Peter Mandelson has said."
politics,"Defiant hunts put ban to the test

Thousands of hunt supporters have been out on the first day of hunting in England and Wales after the ban on hunting with dogs came into force."
politics,"Police urge pub closure power

New powers are needed to close disorderly pubs, bars and clubs for up to a week or even permanently, police chiefs have told MPs."
politics,"Choose hope over fear - Kennedy

Voters will have a clear choice between the politics of fear and the politics of hope in the next general election, said Charles Kennedy."
politics,"Ex-PM Lord Callaghan dies aged 92

Former Labour prime minister Lord Callaghan has died on the eve of his 93rd birthday."
politics,"Kennedy questions trust of Blair

Lib Dem leader Charles Kennedy has said voters now have a ""fundamental lack of trust"" of Tony Blair as prime minister."
politics,"Short attacks US over tsunami aid

Former Cabinet minister Clare Short has criticised the US-led tsunami aid coalition, saying the UN should be leading efforts."
politics,"'Errors' doomed first Dome sale

The initial attempt to sell the Millennium Dome failed due to a catalogue of errors, a report by the government's finance watchdog says."
politics,"Howard dismisses Tory tax fears

Michael Howard has dismissed fears from some Conservatives that his plans for £4bn tax cuts are too modest."
politics,"New 'yob' targets to be unveiled

Fifty new areas getting special help to fight anti-social behaviour in England and Wales will be named on Thursday."
politics,"Boris opposes mayor apology

Ken Livingstone should ""stick to his guns"" and not apologise for his ""Nazi"" comment to a Jewish reporter, Tory MP Boris Johnson has insisted."
politics,"Straw backs ending China embargo

UK Foreign Secretary Jack Straw has defended plans to end the European Union's arms embargo on China, despite opposition from the US and Japan."
politics,"Visa row mandarin made Sir John

The top civil servant at the centre of the David Blunkett visa affair has been knighted in the New Year Honours."
politics,"Prime minister's questions

So who, if anyone, is playing politics with the security of the nation?"
politics,"Tory leader urges Harry apology

Prince Harry should personally make clear how sorry he is about wearing a Nazi uniform to a friend's fancy dress party, says Tory leader Michael Howard."
politics,"Child access laws shake-up

Parents who refuse to allow former partners contact with their children could be electronically tagged under plans being considered by ministers. Curfews and community service orders were other options which could be used if court orders to allow parental access were defied, Lord Falconer said. The constitutional affairs secretary outlined some of the plans on Tuesday. He denied fathers' activists had forced the changes, telling the BBC ""there is a recognition that something is wrong"". Between 15,000 and 20,000 couples go to court to resolve access disputes each year, although in nine out of 10 separations there is no court intervention."
politics,"Student 'fee factor' played down

A rise has been recorded in the number of students from south of the border applying to universities in Scotland."
politics,"Boothroyd calls for Lords speaker

Betty Boothroyd has said the House of Lords needs its own Speaker and that peers should lead the way on reforming the upper chamber."
politics,"Brown names 16 March for Budget

Chancellor Gordon Brown will deliver his Budget to the House of Commons on 16 March, the Treasury has announced."
politics,"Pakistani women 'must not hide'

Hiding women away in the home hidden behind veils is a backward view of Islam, President Musharraf of Pakistan has said during a visit to Britain."
politics,"Lib Dems stress Budget trust gap

Public trust in the handling of the economy can only be restored if Gordon Brown opens up his books for unbiased inspection, say the Lib Dems."
politics,"Housing plans criticised by MPs

""Irreversible environmental damage"" will be caused by government plans to build more than one million homes in south-east England, MPs have warned."
politics,"UKIP could sue Veritas defectors

The UK Independence Party could take legal action to unseat two London Assembly members who defected to Robert Kilroy Silk's Veritas Party."
politics,"Lords wrong on detainees - Straw

Jack Straw has attacked the decision by Britain's highest court that detaining foreign terrorist suspects without trial breaks human rights laws."
politics,"Howard taunts Blair over splits

Tony Blair's feud with Gordon Brown is damaging the way the UK is governed, Tory leader Michael Howard has claimed in a heated prime minister's questions."
politics,"Clarke defends terror detentions

The home secretary has defended his decision not to release foreign terror suspects despite a legal ruling their detention breached human rights laws."
politics,"Tory leader unveils spending plan

Tory leader Michael Howard says his party can save £35bn in government spending by tackling waste."
politics,"Blunkett hints at election call

Ex-Home Secretary David Blunkett has given fresh clues that the general election will be announced on Monday."
politics,"Galloway targets 'New Labour' MP

George Galloway is to stand against pro-Iraq war Labour MP Oona King at the next general election."
politics,"Howard rejects BNP's claim

Tory leader Michael Howard has dismissed claims that his immigration policy was ""moving onto the turf"" of the British National Party (BNP)."
politics,"Turkey deal 'to help world peace'

A deal bringing Turkey a step closer to EU membership is of ""fundamental importance"" to the peace and security of the world, Tony Blair has said."
politics,"Ministers 'naive' over phone-taps

The government is being naive by refusing to allow phone-tap evidence in court, a senior EU politician says."
politics,"Probe launched on Ken Nazi jibe

An investigation by the Standards Board is under way following allegations that Ken Livingstone has brought his office into disrepute."
politics,"February poll claim 'speculation'

Reports that Tony Blair is planning a snap general election for February 2005 have been described as ""idle speculation"" by Downing Street."
politics,"Mandelson warning to BBC

The BBC should steer away from ""demonising"" ex-Downing Street media chief Alastair Campbell, Peter Mandelson has said."
politics,"End Bush 'denial' Blair tells EU

Tony Blair is urging European leaders to wake up from their ""state of denial"" over President Bush's re-election."
politics,"School sport 'is back', says PM

Tony Blair has promised that ""sport is back"" as a priority for schools."
politics,"Lib Dems unveil election slogan

The Liberal Democrats will present themselves as ""the real alternative"" in the forthcoming general election campaign, Charles Kennedy has said."
politics,"Crucial decision on super-casinos

A decision on whether to allow Westminster to legislate on super-casinos is set to be made by the Scottish Parliament."
politics,"UK plan to deport terror suspects

Deals are being sought to allow the UK to deport terror suspects to their home countries without risk of them being tortured or sentenced to death."
politics,"Howard's unfinished business

""He's not finished yet,"" whispered the Conservative Party person as your reporter attempted to slip quietly from the hall. And indeed he wasn't. Michael Howard had already broken away from the printed text of his speech, at his party's spring conference in Brighton, to deliver a smart rebuff to Peter Hain's description of him as an ""attack mongrel"", claiming such personal abuse meant Labour was ""rattled"" by the Tory challenge. And here he was again, moving to the front of the stage as the party faithful rose to their feet in applause, to make a personal, ad-libbed appeal to them to go out and fight for victory. ""One day you will be able to tell your children and grandchildren as I will tell mine, 'I was there. I did my bit. I played my part. I helped to win that famous election - the election that transformed our country for the better'."" The speech, which was peppered with references to Mr Howard's humble beginnings as the ""child of immigrants"", had been introduced by his son Nick, a trainee vicar, who praised his father's honesty. ""I always know where I am with him because all my life he has meant what he has said to me,"" he said. Mr Howard was also joined on stage by his wife Sandra, daughter Larissa and stepson Sholto."
politics,"Lib Dems unveil women's manifesto

The Liberal Democrats are attempting to woo female voters with the launch of their manifesto for women."
politics,"Labour's four little words

Labour has unveiled the four little words that will form the heart of its general election campaign which, for those just returned from the planet Galifray, is ""looming""."
politics,"Howard and Blair tax pledge clash

Tony Blair has said voters will have to wait for Labour's manifesto to see if the party has plans to increase tax."
politics,"Hague's six-figure earnings shown

The rewards of leaving front-bench politics are shown in the latest annual register of members' interests."
politics,"New rules tackle 'sham weddings'

New rules on marriage for foreign nationals living in the UK are coming into force."
politics,"Howard unveils Tory asylum plans

Tory plans to cut immigration to the UK are not racist and will make the asylum system fairer for genuine refugees, Michael Howard has said."
politics,"Muslim police stops 'more likely'

UK Muslims should accept that people of Islamic appearance are more likely to be stopped and searched by police, a Home Office minister has said."
politics,"Blunkett tells of love and pain

David Blunkett has spoken of his love for married publisher Kimberly Quinn for the first time."
politics,"Brown ally rejects Budget spree

Chancellor Gordon Brown's closest ally has denied suggestions there will be a Budget giveaway on 16 March."
politics,"Cardinal criticises Iraq war cost

Billions of pounds spent on conflict in Iraq and in the Middle East should have been used to reduce poverty, Cardinal Cormac Murphy-O'Connor has said."
politics,"'No UK apology' for colonial past

The days of Britain having to apologise for its colonial past are over, Gordon Brown has said."
politics,"Labour seeks to quell feud talk

Labour's leadership put on a show of unity at a campaign poster launch after MPs criticised Tony Blair and Gordon Brown over reports of their rift."
politics,"Anti-terror plan faces first test

Plans to allow Home Secretary Charles Clarke to place terror suspects under house arrest without trial are set for their first real test in Parliament."
politics,"UK heading wrong way - Howard

Tony Blair has had the chance to tackle the problems facing Britain and has failed, Michael Howard has said."
politics,"Brown comes out shooting

Labour may have abolished hunting - but that didn't stop Chancellor Gordon Brown using his Budget to fire both barrels at some of the opposition parties' core election foxes."
politics,"Tsunami debt deal to be announced

Chancellor Gordon Brown has said he hopes to announce a deal to suspend debt interest repayments by tsunami-hit nations later on Friday."
politics,"Leaders meet over Turkish EU bid

Tony Blair has met Italian Prime Minister Silvio Berlusconi and German Chancellor Gerhard Schroeder to talk about Turkey entering the EU."
politics,"Parties' plans for council tax

Anger at council tax rises spilled over into mass protests in 2003, when the average English bill rose 12.9%."
politics,"Hospital suspends 'no Welsh' plan

An English hospital has suspended plans to stop treating Welsh patients who have waited more than three months."
politics,"Whitehall shredding increasing - Tories

Civil servants have drastically stepped up the shredding of official documents, figures compiled by the Tories suggest."
politics,"Donor attacks Blair-Brown 'feud'

The reported feud between Tony Blair and Gordon Brown has prompted a Labour donor to say he will almost certainly refuse to give more funds."
politics,"Fox attacks Blair's Tory 'lies'

Tony Blair lied when he took the UK to war so has no qualms about lying in the election campaign, say the Tories."
politics,"Straw attacked on China arms

Moves to lift the European Union's ban on arms exports to China have been condemned by human rights groups and the Conservatives."
politics,"Visa decision 'every 11 minutes'

Visa processing staff are sometimes expected to rule on an application every 11 minutes, MPs have said."
politics,"Brown in appeal for Labour unity

Gordon Brown has made an appeal for unity after reports claimed Mr Blair went back on a pledge to stand down before the next general election."
politics,"Crisis 'ahead in social sciences'

A national body designed to tackle skills shortages in key subjects should be set up, a committee of MPs has said."
politics,"UK 'needs true immigration data'

A former Home Office minister has called for an independent body to be set up to monitor UK immigration."
politics,"Howard 'truanted to play snooker'

Conservative leader Michael Howard has admitted he used to play truant to spend time with his school friends at a snooker hall."
politics,"Councils 'must find Gypsy sites'

Ministers are telling councils to find more sites for travellers, amid continuing rows concerning a string of unauthorised encampments."
politics,"Profile: David Blunkett

Before he resigned the position of home secretary on Wednesday, David Blunkett had been in charge of a substantial body of government portfolios including race, policing and immigration."
politics,"Kilroy-Silk attacked with slurry

Euro MP Robert Kilroy-Silk has had a bucket of farm slurry thrown over him by a protester in Manchester."
politics,"Council tax rise 'reasonable'

Welsh councils should set their taxes at ""reasonable levels"" after being given an average funding increase of 6%, says the assembly government."
politics,"Top judge clashes with ministers

The UK's top judge has revealed he has clashed with ministers about how the heads of public inquiries are chosen."
politics,"PM apology over jailings

Tony Blair has apologised to two families who suffered one of the UK's biggest miscarriages of justice."
politics,"'EU referendum could cost £80m'

It could cost £80m to run a UK referendum on the European constitution, ministers have revealed."
politics,"UKIP candidate suspended in probe

Eurosceptic party UKIP have suspended a candidate for allegedly suggesting the criminally insane should be killed."
politics,"Kennedy to make temple address

Charles Kennedy is set to address 2,000 people at a Hindu temple as part of an appeal to ethnic minority voters."
politics,"Guantanamo pair's passport ban

The government has written to two of the British men freed from Guantanamo Bay telling them they will not be allowed passports."
politics,"Protect whistleblowers, TUC says

The government should change the law to give more protection to employees who raise health and safety concerns about their workplaces, the TUC has said."
politics,"Labour targets 'hardcore truants'

A fresh crackdown on persistent truants in England has been launched by Education Secretary Ruth Kelly."
politics,"NHS waiting time target is cut

Hospital waiting times for patients in Wales are to be cut, but not to the same extent as those in England."
politics,"UK's 'useless' quangos under fire

The UK has 529 quangos financed with billions of pounds of taxpayers' cash - many of which are useless or duplicate each other's efforts, a report claims."
politics,"Fox attacks Blair's Tory 'lies'

Tony Blair lied when he took the UK to war so has no qualms about lying in the election campaign, say the Tories."
politics,"Concerns at school diploma plan

Final appeals are being made for the government not to ditch the reform plan for England's secondary schools put forward by the Tomlinson report."
politics,"Tories 'would cut number of MPs'

The Conservative Party would cut the number of MPs by about one-fifth if they were elected, Tory leader Michael Howard has said."
politics,"Brown and Blair face new rift claims

For the umpteenth time, Tony Blair and Gordon Brown are said to have declared all out war on each other."
politics,"Chancellor rallies Labour voters

Gordon Brown has issued a rallying cry, telling supporters the ""stakes are too high"" to stay at home or protest vote in the forthcoming general election."
politics,"Kilroy-Silk quits 'shameful' UKIP

Ex-chat show host Robert Kilroy-Silk has quit the UK Independence Party and accused it of betraying its supporters."
politics,"Howard denies split over ID cards

Michael Howard has denied his shadow cabinet was split over its decision to back controversial Labour plans to introduce ID cards."
politics,"Tory backing for ID cards

The Tories are to back controversial government plans to introduce ID cards."
politics,"Galloway plea for hostage release

Ex-Labour MP George Galloway has appealed for the release of aid worker Margaret Hassan, kidnapped in Iraq."
politics,"'Last chance' warning for voters

People in England, Scotland and Wales must have registered by 1700 GMT to be able to vote in the general election if it is held, as expected, on 5 May."
politics,"Butler launches attack on Blair

Former civil service chief Lord Butler has criticised the way Tony Blair's government operates, accusing it of being obsessed with headlines."
politics,"UKIP candidate suspended

Eurosceptic party UKIP have suspended a candidate for allegedly suggesting the criminally insane should be killed."
politics,"Tories unveil quango blitz plans

Plans to abolish 162 quangos have been unveiled by the Conservatives as part of their effort to show how government red tape can be cut."
politics,"Strike threat over pension plans

Millions of public service workers could strike if ministers scrap their final salary pension scheme and make them work longer, warn union leaders."
politics,"Tories leave door open for Archer

The Conservative Party would deal ""sympathetically"" with any application by disgraced peer Lord Archer to rejoin its ranks, its co-chairman has said."
politics,"Tutu's Guantanamo release call

Archbishop Desmond Tutu has called for the release of the remaining inmates at Guantanamo Bay and terror suspects detained without trial in the UK."
politics,"Brown calls for £5.5bn Aids fund

Gordon Brown has called on rich nations to fund a £5.5bn ($10bn) plan to fight the Aids epidemic and find a vaccine."
politics,"Taxes must be trusted - Kennedy

Public trust in taxes is breaking down because Labour and Tories are not being straight with people on the issue, Lib Dem leader Charles Kennedy has said."
politics,"Will the Budget bring out smiling voters?

As Tory spokesman Oliver Letwin said - any chancellor would use his pre-election budget to offer some vote winning sweeteners, wouldn't he."
politics,"Goldsmith denies war advice claim

The attorney general has denied his statement to Parliament about the legality of the Iraq war was drafted by Downing Street officials."
politics,"Parties build up poll war chests

The Labour Party received more than £5m in donations in the final quarter of 2004, new figures show."
politics,"'Nuclear dumpsite' plan attacked

Plans to allow foreign nuclear waste to be permanently stored in the UK have been branded ""deeply irresponsible"" by the Liberal Democrats."
politics,"Defection timed to hit tax pledge

With impeccable and precisely-calculated timing, Tory defector Robert Jackson and his new Labour bosses have attempted to overshadow Michael Howard's latest announcement on taxation and spending."
politics,"Brown targets OAPs and homebuyers

Gordon Brown has doubled the level at which house buyers pay stamp duty to £120,000 as he put the economy at the heart of Labour's election campaign."
politics,"Blunkett row should end - Blair

Prime Minister Tony Blair said it was time to draw a line under the controversy surrounding David Blunkett."
politics,"Sport betting rules in spotlight

A group of MPs and peers has called for a tightening of regulations controlling betting on sport."
politics,"Cabinet anger at Brown cash raid

Ministers are unhappy about plans to use Whitehall cash to keep council tax bills down, local government minister Nick Raynsford has acknowledged."
politics,"Councils prepare to set tax rises

Council tax in Scotland is set to rise by an average of about 4% in the coming year, BBC Scotland has learned."
politics,"MPs criticise child access system

Divorced parents seeking access to their children are often disadvantaged by the legal system, MPs have said."
politics,"Hague 'given up' his PM ambition

Former Conservative leader William Hague says he will not stand for the leadership again, having given up his ambition to be prime minister."
politics,"Tories plan migrant health checks

Non-European Union citizens wanting to work in the UK will have to undergo tests for Tuberculosis and HIV, under plans unveiled by the Conservatives."
politics,"Lawyer attacks anti-terror laws

A senior barrister who has resigned in protest over the government's anti-terror laws says the current system is giving Britain a bad name."
politics,"Howard pitches for UK ethnic vote

Michael Howard is to make a pitch for Britain's ethnic vote urging people who feel ""taken for granted"" by Tony Blair to vote Conservative."
politics,"UKIP's secret weapon?

By any measure, New Yorker Dick Morris is that thing Americans love over everything else - a winner."
politics,"Clarke plans migrant point scheme

Anyone planning to move to the UK will have to pass a test to prove they can contribute to the country, Home Secretary Charles Clarke has said."
politics,"Candidate resigns over BNP link

A prospective candidate for the UK Independence Party (UKIP) has resigned after admitting a ""brief attachment"" to the British National Party(BNP)."
politics,"Brown outlines third term vision

Gordon Brown has outlined what he thinks should be the key themes of New Labour's next general election bid."
politics,"Kennedy looks to election gains

They may not know quite how to describe their position in British politics - the real opposition, the valid opposition, the effective opposition or the authentic opposition."
politics,"Scots smoking ban details set out

Smoke-free areas will save lives and improve Scotland's health, First Minister Jack McConnell has insisted."
politics,"Labour's 'EU propaganda'

A ""taxpayer subsidised propaganda exercise"" on the EU is being used to lull the British public into a false sense of security, say the Tories."
politics,"Blair's hope for Blunkett return

The events leading to David Blunkett's resignation must not ""swept under the carpet"", the Tories have warned."
politics,"Commons hunt protest charges

Eight protesters who stormed the House of Commons chamber during a debate on the Hunting Bill have been charged with disorderly conduct."
politics,"Plaid MP's cottage arson claim

A Plaid Cymru MP believes UK security services were involved in some arson attacks blamed on Welsh extremists."
politics,"Tsunami 'won't divert Africa aid'

UK aid to help the victims of the Asian tsunami disaster will not take much needed relief from Africa, Prime Minister Tony Blair has promised."
politics,"Tory expert denies defeatism

The Conservatives' campaign director has denied a report claiming he warned Michael Howard the party could not win the next general election."
politics,"'Super union' merger plan touted

Two of Britain's big trade unions could merge to form a ""super union"" of two million members."
politics,"Blair 'damaged' by Blunkett row

A majority of voters (68%) believe the prime minister has been damaged by the row over David Blunkett's involvement in a visa application, a poll suggests."
politics,"Teenagers to be allowed to be MPs

Teenagers will be able to become MPs under plans unveiled by ministers."
politics,"Blair joins school sailing trip

The prime minister has donned a life jacket and joined school children in a sailing dinghy as he sought to sell his party's education policies."
politics,"Peace demo appeal rejected

Peace protestors have lost a landmark appeal over police actions in stopping an anti-war demonstration days after the start of the Iraq war."
politics,"Tory leader 'cleared' over work

Scottish Conservative Party leader David McLetchie claims he has been cleared over a potential conflict of interest."
